contradiction,type,t,h
YES,numeric,"Claimant's application alleged an accident in September 1990. He initially testified to a specific accident in which he hit a pothole causing him to ""bottom out"" in his seat. The history provided to his treating doctor alleged a specific incident in February or March 1991.","In 1992, claimant testified that his pain began getting worse four to five months after treatment in September of 1990. The records of his treating doctor indicated pain with no known trauma."
YES,WK,A common situation is a witness who testifies the light was green at trial.,During a prior deposition the witness insisted the light was red.
YES,antonym,"Since Dolan was paid for nine consecutive weeks, the referee for the Appeals Tribunal found payment to Dolan for his waiting week was appropriate.","The division argued on appeal that since the referee found Dolan had been overpaid for those two weeks, which would have been weeks eight and nine of his nine consecutive weeks of benefits, Dolan was technically only paid for seven consecutive weeks of benefits, making payment for the waiting week improper."
YES,lexical,At one point Zain had said the blood was the defendant's.,"At another point, Zain had identified the blood as the victim's."
YES,lexical,"In a June 10 deposition, Youssef claimed there is no record documenting increased damaged to the cathedral since the latest report in September 1995, O'Brien said.","But on a June 7 videotape submitted to the court, the judge said Youssef identified new cracks that developed after the May 23 quake."
YES,structure,"Gregg Miner, the company's general manager, originally stated that it was the management team that selected the supervisor for the RIF.",Gregg Miner acknowledged that he probably had been the one to select Whittington for the RIF.
YES,WK_temporal,"Dr. Long-Gue Hu, JCMC's chief obstetric/gynecological resident, reviewed the August 13 sonogram but did not detect spina bifida. Hu testified the August 13 sonogram was probably taken at FHC, and he most probably reviewed it on that date.","Dr. Long-Gue Hu determined the August 13 sonogram was taken at JCMC, and he probably did not review it until the end of August."
YES,negation,The defendant argued that Likens was not qualified to give either an expert opinion under Ind.Evid.Rule 702 or a lay opinion under Ind.Evid.Rule 701.,"The court disagreed and found that while Likens was not sufficiently qualified as an expert under Rule 702, he was qualified as a skilled witness under Rule 701."
YES,WK,Official ticket sales for the Cure's tour haven't been released yet.,The Cure's management says venues have been selling close to capacity.
YES,WK,"Her lawyer, Richard Herman, had previously insisted Knight was a ""normal young woman"" with no mental problems and said she had written a letter of apology to Zeta-Jones and Douglas.","But after the two Hollywood stars delivered chilling testimony at a preliminary hearing in July, Mr Herman told reporters that ""what's actually happened is that Catherine Zeta-Jones has driven Dawnette to attempt suicide and the real blood is on her hands""."
YES,WK,"The hearing was also halted on Thursday, when the defense attorney said his client was still groggy after taking sleeping pills because she wanted a good night's sleep.",But on Friday he said it was an attempted suicide by an overdose of barbiturates.
YES,negation,"The transition to the younger Mr Lee ""will not offer much comfort to those seeking more openness,"" he said, ""his speeches very much resemble his father's.""","But Steve Chia, one of Singapore's few non-PAP politicians and a vocal government critic, said he expected Mr Lee's leadership to be ""more open and consultative"", particularly on social issues."
YES,WK_location,"When his friends cut the cord that had tied his lawnchair to his jeep, Walters' lawnchair quickly rose to a height of about 16,000 feet (4,876 m); fearing that he might get himself into even deeper trouble, he did not dare shoot any balloons, instead drifting over Los Angeles and crossing the primary approach corridor of Los Angeles International Airport.","When his friends cut the cord that had tied his lawnchair to his jeep, Walters' lawnchair quickly rose to a height of about 16,000 feet (4,876 m); fearing that he might get himself into even deeper trouble, he did not dare shoot any balloons, instead drifting over Long Beach and crossing the primary approach corridor of Long Beach airport."
YES,WK,"He went on to buy 45 4-foot-diameter weather balloons in an army-navy surplus store, attaching them to his lawnchair and then filling them with helium after donning a parachute and strapping himself to the chair with a pellet gun, a CB radio, some sandwiches, soft drinks, and a camera; however, things did not work out as he had planned.",He and his girlfriend purchased 45 four-foot weather balloons and helium tanks at a store called California Toy Time Balloons.
YES,numeric,"On 20 January 1986, a military coup led by Major General Justin Metsing Lekhanya deposed the Jonathan government.","On 15 January 1986, a military coup led by Major General Justin Metsing Lekhanya deposed the Jonathan government."
YES,numeric,"There are five tenses in Low German: Present tense, Preterite, Perfect, Past Perfect, and Future.","There are four tenses in Low German: Present tense, Preterite, Perfect, and Pluperfect."
YES,numeric,"Historians estimate that about 20% of the white population may have been Loyalists (that is, about 500,000), but there are no exact numbers.","Historians estimate that about 5% of the white population may have been Loyalists (that is, about 100,000), but there are no exact numbers."
YES,numeric,"However once independence was declared in 1776 Loyalists who continued to support the Crown were treated by the Patriots as traitors who turned against their fellow citizens and collaborated with a foreign army. They were expelled, or disarmed, but none were tried for treason or executed.",However relatively few Loyalist civilians are thought to have been killed by mobs; two men in Philadelphia were officially executed for supporting the British.
YES,WK_temporal,"Alain Choquet (born October 18, 1901 - dead October 29, 1991 at Saint-Laurent is a Quebec actor and recording artist.","In 2002, with Pierre René, Choquet formed Disques La Julienne."
YES,negation,The American Reform Party is a minor political party in the United States that was formed in a factional split from the larger Reform Party of the United States in October 1997.,"The American Reform Party is not a political party, they do not have ballot access in any state, and they do not run candidates."
YES,WK,"On 23 December 1990, less than two weeks before Tammy's 16th birthday, Karla Homolka and her fiancé, Paul Bernardo, plied Tammy with Halcion, a sedative, and raped her.","Karla Homolka eventually conceded and obtained a bottle of Halothane (a liquid general anesthetic) from the veterinary clinic where she worked, that would later be used to sedate Tammy during the rape."
YES,lexical,"Originally Tarantino's screenplay began with the same ""I'd fuck Elvis"" scene, set before the opening credits, as the release.",The first scene in Tarantino's script is the scene where Drexl steals the cocaine.
YES,lexical,"In the book, Suskind writes, among other things, that sources in the intelligence community revealed to him that Abu Zubaydah knew nothing about the operations of al-Qaeda, but rather was al-Qaeda's go-to guy for minor logistics such as travel for wives and children.","Abu Zubaydah was, according to American authorities, a high-ranking member of al-Qaeda and close associate of Osama bin Laden, though there are doubts of his power and connections due to the fact that most information came from interrogations where Zubaydah was known to vastly exaggerate his and al-Quaeda's role in international terror."
YES,numeric,"The first BBS, ALOHA.net, was created at the University of Hawaii in 1972.","Snowed in during The Great Chicago Snowstorm of 1978, Ward Christensen began preliminary work on what would eventually become the first BBS to exist. The first BBS, CBBS, went online on February 16, 1978 in Chicago, Illinois."
YES,numeric,Minesweeper is a single-player computer game invented by Robert Donner in 1989.,"There was a version on a Tektronix 4051 around 1981, but the tradition of passing around a 'games tape' goes back to at least 1973. This tape even contains a 3D version of minesweeper. The author of this game, David Ahl is a crucial figure in the early history of computer games."
YES,numeric,It has been criticized as pseudoscientific quackery by most professional scientists and members of the medical community.,It has been criticized as pseudoscientific quackery by some professional scientists and members of the medical community.
YES,numeric,"He became a Field Marshal in the British Army in 1940, and served in the Imperial War Cabinet under Winston Churchill.","He became a Field Marshal in the British Army in 1941, and served in the Imperial War Cabinet under Winston Churchill."
YES,structure,"Currently, I-75 is 15 lanes wide at the Windy Hill Interchange (8 northbound, 7 southbound), and as such, is the widest freeway in the world.","Bisecting the city from west to east across its inner suburbs, Highway 401 (or simply, ""the 401"") acts as a bypass of the downtown core, and is both the busiest and widest highway in the world."
YES,numeric,"In Turkey, there are around 820 higher education institutes including universities, with a total student enrollment of over 1 million.","The total capacity of Turkish universities is approximately 300,000."
YES,lexical,"Turkey seeks to improve its investment climate through administrative streamlining, an end to foreign investment screening, and strengthened intellectual property legislation.","A number of disputes involving foreign investors in Turkey and certain policies, such as high taxation of cola products and continuing gaps in the intellectual property regime, inhibit investment."
